{
  "schema": "sibyl-checkpoint/1",
  "checkpoint_id": "019276a2-0c4d-7e5f-8a61-2b3c4d5e6f71",
  "tenant_id": "0192767f-0000-7000-8000-00000000a001",
  "agent_id": "0192767f-0000-7000-8000-00000000c010",
  "task_id": "019276a0-9c1d-7e3f-9a52-1b2c3d4e5f60",
  "seq": 2,
  "step_index": 3,
  "step_name": "price_quote",
  "created_at": "2026-10-09T09:14:35.001Z",
  "goal": "Produce and send a price quote for order #A-88213 to the customer contact on file",
  "state": {
    "rfq": {
      "sku": "PAL-40",
      "qty": 40,
      "city": "Pune"
    },
    "order": {
      "id": "A-88213",
      "tier": "B"
    },
    "quote_inr": 418000
  },
  "state_bytes": 9120,
  "state_sha256": "0c3a2e1f9d8b7a6c5e4d3f2a1b0c9d8e7f6a5b4c3d2e1f0a9b8c7d6e5f4a3b2c",
  "state_schema": "app:quote_pipeline/v3",
  "completed_steps": [
    {
      "index": 0,
      "step": "parse_rfq",
      "started_at": "2026-10-09T09:14:10.000Z",
      "ended_at": "2026-10-09T09:14:12.400Z",
      "output": {
        "preview": "{\"sku\":\"PAL-40\",\"qty\":40,\"city\":\"Pune\",\"by\":\"2026-10-15\"}"
      },
      "assumed": false
    },
    {
      "index": 1,
      "step": "lookup_order",
      "started_at": "2026-10-09T09:14:30.000Z",
      "ended_at": "2026-10-09T09:14:32.600Z",
      "tool_name": "lookup_order",
      "call_id": "019276a1-4a2b-7c1d-8e30-f1e2d3c4b5a6",
      "output": {
        "preview": "order A-88213: credit ok, pricing tier B"
      },
      "assumed": false
    },
    {
      "index": 2,
      "step": "price_quote",
      "started_at": "2026-10-09T09:14:33.000Z",
      "ended_at": "2026-10-09T09:14:34.900Z",
      "output": {
        "preview": "INR 4,18,000 incl. freight; validity 7 days"
      },
      "assumed": false
    }
  ],
  "pending_steps": [
    {
      "index": 4,
      "step": "send_quote",
      "description": "Send the drafted email via CRM send_email tool",
      "inputs_needed": [
        "approved draft"
      ]
    },
    {
      "index": 5,
      "step": "log_crm",
      "description": "Record quote in CRM opportunity 7731"
    }
  ],
  "side_effects": [
    {
      "kind": "api_call",
      "target": "crm.lookup_order",
      "at": "2026-10-09T09:14:32.600Z",
      "reversible": true,
      "assumed": false,
      "evidence_span_id": "00f067aa0ba902b7"
    }
  ],
  "redaction": {
    "capture_mode": "full",
    "profile": {
      "id": "secrets_only",
      "version": 1,
      "rules_fired": [],
      "secrets_scrubbed": 0
    },
    "fields_redacted": []
  },
  "provenance": {
    "sdk_version": "0.1.0",
    "trace_id": "4bf92f3577b34da6a3ce929d0e0e4736",
    "span_id": "7a1b2c3d4e5f6071",
    "prev_checkpoint_id": "019276a1-0000-7000-8000-000000000001"
  }
}
